"Aguav Berry","Restores 1/8 max HP at 1/2 max HP or less; confuses if -SpD Nature. Single use.",
"Apicot Berry","Raises holder's Sp. Def by 1 stage when at 1/4 max HP or less. Single use.",
"Aspear Berry","Holder is cured if it is frozen. Single use.",
"Belue Berry","Cannot be eaten by the holder. No effect when eaten with Bug Bite or Pluck.",
"Black Belt","Holder's Fighting-type attacks have 1.1x power.",
"Black Glasses","Holder's Dark-type attacks have 1.1x power.",
"Bluk Berry","Cannot be eaten by the holder. No effect when eaten with Bug Bite or Pluck.",
"Bright Powder","The accuracy of attacks against the holder is 0.9x.",
"Charcoal","Holder's Fire-type attacks have 1.1x power.",
"Cheri Berry","Holder cures itself if it is paralyzed. Single use.",
"Chesto Berry","Holder wakes up if it is asleep. Single use.",
"Choice Band","Holder's Attack is 1.5x, but it can only select the first move it executes.",
"Claw Fossil","Can be revived into Anorith.",
"Cornn Berry","Cannot be eaten by the holder. No effect when eaten with Bug Bite or Pluck.",
"Deep Sea Scale","If held by a Clamperl, its Sp. Def is doubled. Evolves Clamperl into Gorebyss when traded.",
"Deep Sea Tooth","If held by a Clamperl, its Sp. Atk is doubled. Evolves Clamperl into Huntail when traded.",
"Dive Ball","A Poke Ball that works especially well on Pokemon that live underwater.",
"Dome Fossil","Can be revived into Kabuto.",
"Dragon Fang","Holder's Dragon-type attacks have 1.1x power.",
"Dragon Scale","Evolves Seadra into Kingdra when traded.",
"Durin Berry","Cannot be eaten by the holder. No effect when eaten with Bug Bite or Pluck.",
"Figy Berry","Restores 1/8 max HP at 1/2 max HP or less; confuses if -Atk Nature. Single use.",
"Fire Stone","Evolves Vulpix into Ninetales, Growlithe into Arcanine, Eevee into Flareon, and Pansear into Simisear when used.",
"Focus Band","Holder has a 10% chance to survive an attack that would KO it with 1 HP.",
"Friend Ball","A Poke Ball that makes caught Pokemon more friendly.",
"Ganlon Berry","Raises holder's Defense by 1 stage when at 1/4 max HP or less. Single use.",
"Great Ball","A high-performance Ball that provides a higher catch rate than a Poke Ball.",
"Grepa Berry","Cannot be eaten by the holder. No effect when eaten with Bug Bite or Pluck.",
"Hard Stone","Holder's Rock-type attacks have 1.1x power.",
"Helix Fossil","Can be revived into Omanyte.",
"Hondew Berry","Cannot be eaten by the holder. No effect when eaten with Bug Bite or Pluck.",
"Iapapa Berry","Restores 1/8 max HP at 1/2 max HP or less; confuses if -Def Nature. Single use.",
"Kelpsy Berry","Cannot be eaten by the holder. No effect when eaten with Bug Bite or Pluck.",
"King's Rock","Holder's attacks without a chance to make the target flinch gain a 10% chance to make the target flinch. Evolves Poliwhirl into Politoed and Slowpoke into Slowking when traded.",
"Lansat Berry","Holder gains the Focus Energy effect when at 1/4 max HP or less. Single use.",
"Lax Incense","The accuracy of attacks against the holder is 0.95x.",
"Leaf Stone","Evolves Gloom into Vileplume, Weepinbell into Victreebel, Exeggcute into Exeggutor or Alolan Exeggutor, Nuzleaf into Shiftry, and Pansage into Simisage when used.",
"Leftovers","At the end of every turn, holder restores 1/16 of its max HP.",
"Leppa Berry","Restores 10 PP to the first of the holder's moves to reach 0 PP. Single use.",
"Liechi Berry","Raises holder's Attack by 1 stage when at 1/4 max HP or less. Single use.",
"Light Ball","If held by a Pikachu, its Special Attack is doubled.",
"Lucky Punch","If held by a Chansey, its critical hit ratio is raised by 2 stages.",
"Lum Berry","Holder cures itself if it has a non-volatile status or is confused. Single use.",
"Luxury Ball","A comfortable Poke Ball that makes a caught wild Pokemon quickly grow friendly.",
"Macho Brace","Holder's Speed is halved. The Klutz Ability does not ignore this effect.",
"Magnet","Holder's Electric-type attacks have 1.1x power.",
"Mago Berry","Restores 1/8 max HP at 1/2 max HP or less; confuses if -Spe Nature. Single use.",
"Magost Berry","Cannot be eaten by the holder. No effect when eaten with Bug Bite or Pluck.",
"Mail","Cannot be given to or taken from a Pokemon, except by Covet/Knock Off/Thief.",
"Master Ball","The best Ball with the ultimate performance. It will catch any wild Pokemon.",
"Mental Herb","Holder is cured if it is infatuated. Single use.",
"Metal Coat","Holder's Steel-type attacks have 1.1x power. Evolves Onix into Steelix and Scyther into Scizor when traded.",
"Metal Powder","If held by a Ditto that hasn't Transformed, its Defense is doubled.",
"Miracle Seed","Holder's Grass-type attacks have 1.1x power.",
"Moon Stone","Evolves Nidorina into Nidoqueen, Nidorino into Nidoking, Clefairy into Clefable, Jigglypuff into Wigglytuff, Skitty into Delcatty, and Munna into Musharna when used.",
"Mystic Water","Holder's Water-type attacks have 1.1x power.",
"Nanab Berry","Cannot be eaten by the holder. No effect when eaten with Bug Bite or Pluck.",
"Nest Ball","A Poke Ball that works especially well on weaker Pokemon in the wild.",
"Net Ball","A Poke Ball that works especially well on Water- and Bug-type Pokemon.",
"Never-Melt Ice","Holder's Ice-type attacks have 1.1x power.",
"Nomel Berry","Cannot be eaten by the holder. No effect when eaten with Bug Bite or Pluck.",
"Old Amber","Can be revived into Aerodactyl.",
"Oran Berry","Restores 10 HP when at 1/2 max HP or less. Single use.",
"Pamtre Berry","Cannot be eaten by the holder. No effect when eaten with Bug Bite or Pluck.",
"Pecha Berry","Holder is cured if it is poisoned. Single use.",
"Persim Berry","Holder is cured if it is confused. Single use.",
"Petaya Berry","Raises holder's Sp. Atk by 1 stage when at 1/4 max HP or less. Single use.",
"Pinap Berry","Cannot be eaten by the holder. No effect when eaten with Bug Bite or Pluck.",
"Poison Barb","Holder's Poison-type attacks have 1.1x power.",
"Poke Ball","A device for catching wild Pokemon. It is designed as a capsule system.",
"Pomeg Berry","Cannot be eaten by the holder. No effect when eaten with Bug Bite or Pluck.",
"Premier Ball","A rare Poke Ball that has been crafted to commemorate an event.",
"Qualot Berry","Cannot be eaten by the holder. No effect when eaten with Bug Bite or Pluck.",
"Quick Claw","Each turn, holder has a 20% chance to move first in its priority bracket.",
"Rabuta Berry","Cannot be eaten by the holder. No effect when eaten with Bug Bite or Pluck.",
"Rawst Berry","Holder is cured if it is burned. Single use.",
"Razz Berry","Cannot be eaten by the holder. No effect when eaten with Bug Bite or Pluck.",
"Repeat Ball","A Poke Ball that works well on Pokemon species that were previously caught.",
"Root Fossil","Can be revived into Lileep.",
"Salac Berry","Raises holder's Speed by 1 stage when at 1/4 max HP or less. Single use.",
"Scope Lens","Holder's critical hit ratio is raised by 1 stage.",
"Sea Incense","Holder's Water-type attacks have 1.05x power.",
"Sharp Beak","Holder's Flying-type attacks have 1.1x power.",
"Shell Bell","After an attack, holder gains 1/8 of the damage in HP dealt to other Pokemon.",
"Silk Scarf","Holder's Normal-type attacks have 1.1x power.",
"Silver Powder","Holder's Bug-type attacks have 1.1x power.",
"Sitrus Berry","Restores 30 HP when at 1/2 max HP or less. Single use.",
"Soft Sand","Holder's Ground-type attacks have 1.1x power.",
"Soul Dew","If held by a Latias or a Latios, its Sp. Atk and Sp. Def are 1.5x.",
"Spell Tag","Holder's Ghost-type attacks have 1.1x power.",
"Spelon Berry","Cannot be eaten by the holder. No effect when eaten with Bug Bite or Pluck.",
"Starf Berry","Raises a random stat by 2 when at 1/4 max HP or less (not acc/eva). Single use.",
"Stick","If held by a Farfetch'd, its critical hit ratio is raised by 2 stages.",
"Sun Stone","Evolves Gloom into Bellossom, Sunkern into Sunflora, Cottonee into Whimsicott, Petilil into Lilligant, and Helioptile into Heliolisk when used.",
"Tamato Berry","Cannot be eaten by the holder. No effect when eaten with Bug Bite or Pluck.",
"Thick Club","If held by a Cubone or a Marowak, its Attack is doubled.",
"Thunder Stone","Evolves Pikachu into Raichu or Alolan Raichu, Eevee into Jolteon, and Eelektrik into Eelektross when used.",
"Timer Ball","A Poke Ball that becomes better the more turns there are in a battle.",
"Twisted Spoon","Holder's Psychic-type attacks have 1.1x power.",
"Ultra Ball","An ultra-performance Ball that provides a higher catch rate than a Great Ball.",
"Up-Grade","Evolves Porygon into Porygon2 when traded.",
"Water Stone","Evolves Poliwhirl into Poliwrath, Shellder into Cloyster, Staryu into Starmie, Eevee into Vaporeon, Lombre into Ludicolo, and Panpour into Simipour when used.",
"Watmel Berry","Cannot be eaten by the holder. No effect when eaten with Bug Bite or Pluck.",
"Wepear Berry","Cannot be eaten by the holder. No effect when eaten with Bug Bite or Pluck.",
"White Herb","Restores all lowered stat stages to 0 when one is less than 0. Single use.",
"Wiki Berry","Restores 1/8 max HP at 1/2 max HP or less; confuses if -SpA Nature. Single use.",
